{
 "artisan": {
  "decided_at": null,
  "decision_verdict": null,
  "notes": null,
  "queue_id": "AR-0001",
  "required": true,
  "reviewer": null,
  "status": "pending"
 },
 "assessment_id": "MA-0002",
 "auto": {
  "blocking_rules": [],
  "evaluated_rules": 20,
  "verdict": "conditionally_manufacturable"
 },
 "blockers": [],
 "concept_id": "DC-0003",
 "created_at": "2026-10-23T00:00:00Z",
 "facts": {
  "alloy": "18k_gold",
  "chain_link_mm": 0,
  "enamel": false,
  "enamel_firing_c": 0,
  "engraving_depth_mm": 0.3,
  "hollow_cast": true,
  "max_dimension_mm": 42,
  "min_wall_thickness_mm": 0.7,
  "prong_count": 0,
  "prong_thickness_mm": 0,
  "recessed_area": true,
  "ring_size_mm": 0,
  "setting_type": "none",
  "stone_count": 0,
  "stone_size_mm": 0,
  "surface_finish": "polished",
  "undercut": true
 },
 "final_verdict": "conditionally_manufacturable",
 "fixes": [
  {
   "rule_id": "JW-CAST-002",
   "suggested_change": {
    "min_wall_thickness_mm": 0.8
   },
   "text": {
    "en": "Take the wall to 0.8 mm, or cast solid and hollow out afterwards.",
    "zh": "壁厚加到 0.8 mm，或改为实心铸造后掏空。"
   }
  },
  {
   "rule_id": "JW-CHASE-002",
   "suggested_change": {
    "undercut": false
   },
   "text": {
    "en": "Turn the undercut into a releasable draft angle, or accept the split-mould cost.",
    "zh": "把倒扣改成可脱模的斜角，或接受分模成本。"
   }
  }
 ],
 "industry": "jewelry",
 "missing_facts": [],
 "reproducibility": {
  "facts_hash": "16c6b8164ecb882376f8916bf73948441e740d3fd3ce23305f4e4afcfb545c64",
  "rules_version": "1.0.0"
 },
 "rule_evaluations": [
  {
   "facts_used": [
    "min_wall_thickness_mm"
   ],
   "reason": {
    "en": "Below this workshop's castable wall",
    "zh": "低于本厂可铸最小壁厚"
   },
   "rule_id": "CAP-JW-A-01",
   "severity": "blocker",
   "source": "capability",
   "status": "pass"
  },
  {
   "facts_used": [
    "max_dimension_mm"
   ],
   "reason": {
    "en": "Above this workshop's casting envelope",
    "zh": "超出本厂铸造尺寸"
   },
   "rule_id": "CAP-JW-A-02",
   "severity": "blocker",
   "source": "capability",
   "status": "pass"
  },
  {
   "facts_used": [
    "alloy"
   ],
   "reason": {
    "en": "Alloy not handled here",
    "zh": "本厂不处理该合金"
   },
   "rule_id": "CAP-JW-A-03",
   "severity": "blocker",
   "source": "capability",
   "status": "pass"
  },
  {
   "facts_used": [
    "ring_size_mm"
   ],
   "reason": {
    "en": "Ring below the smallest mandrel",
    "zh": "戒圈小于本厂最小手寸"
   },
   "rule_id": "CAP-JW-A-04",
   "severity": "blocker",
   "source": "capability",
   "status": "na"
  },
  {
   "facts_used": [
    "ring_size_mm"
   ],
   "reason": {
    "en": "Ring above the largest mandrel",
    "zh": "戒圈大于本厂最大手寸"
   },
   "rule_id": "CAP-JW-A-05",
   "severity": "blocker",
   "source": "capability",
   "status": "na"
  },
  {
   "facts_used": [
    "enamel",
    "enamel_firing_c"
   ],
   "reason": {
    "en": "Above this kiln's temperature",
    "zh": "超出本厂珐琅窑温度"
   },
   "rule_id": "CAP-JW-A-06",
   "severity": "blocker",
   "source": "capability",
   "status": "na"
  },
  {
   "facts_used": [
    "min_wall_thickness_mm"
   ],
   "reason": {
    "en": "Wall below the castable limit",
    "zh": "壁厚低于可铸下限"
   },
   "rule_id": "JW-CAST-001",
   "severity": "blocker",
   "source": "rule",
   "status": "pass"
  },
  {
   "facts_used": [
    "hollow_cast",
    "min_wall_thickness_mm"
   ],
   "reason": {
    "en": "Hollow casting at 0.7 mm needs a core support; yield drops and lead time grows.",
    "zh": "空心铸造配 0.7 mm 壁厚需要内芯支撑，良率下降并延长交期。"
   },
   "rule_id": "JW-CAST-002",
   "severity": "cost",
   "source": "rule",
   "status": "fail"
  },
  {
   "facts_used": [
    "setting_type",
    "stone_size_mm"
   ],
   "reason": {
    "en": "Large stone without a setting",
    "zh": "大石无镶口"
   },
   "rule_id": "JW-SET-001",
   "severity": "blocker",
   "source": "rule",
   "status": "pass"
  },
  {
   "facts_used": [
    "prong_thickness_mm"
   ],
   "reason": {
    "en": "Prong too thin",
    "zh": "镶爪过细"
   },
   "rule_id": "JW-SET-002",
   "severity": "blocker",
   "source": "rule",
   "status": "pass"
  },
  {
   "facts_used": [
    "setting_type",
    "stone_size_mm"
   ],
   "reason": {
    "en": "Stone too small for pavé",
    "zh": "碎钻过小无法密镶"
   },
   "rule_id": "JW-SET-003",
   "severity": "blocker",
   "source": "rule",
   "status": "pass"
  },
  {
   "facts_used": [
    "engraving_depth_mm"
   ],
   "reason": {
    "en": "Chasing deeper than one pass",
    "zh": "錾刻深度超单次行程"
   },
   "rule_id": "JW-CHASE-001",
   "severity": "cost",
   "source": "rule",
   "status": "pass"
  },
  {
   "facts_used": [
    "undercut"
   ],
   "reason": {
    "en": "The undercut cannot release from a single mould; it needs a three-part mould or a casting re-orientation, adding cost and lead time.",
    "zh": "存在倒扣结构，单件模具无法脱模，需要三件分模或改铸造方向，报价与交期都要加。"
   },
   "rule_id": "JW-CHASE-002",
   "severity": "cost",
   "source": "rule",
   "status": "fail"
  },
  {
   "facts_used": [
    "recessed_area",
    "surface_finish"
   ],
   "reason": {
    "en": "Mirror polish cannot reach the recess",
    "zh": "镜面处理无法进入凹面"
   },
   "rule_id": "JW-SURF-001",
   "severity": "cost",
   "source": "rule",
   "status": "pass"
  },
  {
   "facts_used": [
    "enamel",
    "enamel_firing_c"
   ],
   "reason": {
    "en": "Enamel firing runs hot",
    "zh": "珐琅烧成温度偏高"
   },
   "rule_id": "JW-SURF-002",
   "severity": "cost",
   "source": "rule",
   "status": "pass"
  },
  {
   "facts_used": [
    "ring_size_mm"
   ],
   "reason": {
    "en": "Small ring size needs a custom mandrel",
    "zh": "手寸偏小需定制撑圈"
   },
   "rule_id": "JW-FORM-001",
   "severity": "cost",
   "source": "rule",
   "status": "pass"
  },
  {
   "facts_used": [
    "chain_link_mm"
   ],
   "reason": {
    "en": "Chain link too thin",
    "zh": "链节过细"
   },
   "rule_id": "JW-FORM-002",
   "severity": "blocker",
   "source": "rule",
   "status": "pass"
  },
  {
   "facts_used": [
    "alloy",
    "min_wall_thickness_mm"
   ],
   "reason": {
    "en": "Thin platinum is hard to form",
    "zh": "铂金薄壁难成型"
   },
   "rule_id": "JW-MAT-001",
   "severity": "cost",
   "source": "rule",
   "status": "pass"
  },
  {
   "facts_used": [
    "alloy",
    "prong_thickness_mm"
   ],
   "reason": {
    "en": "High-karat prongs deform",
    "zh": "高金合金爪易变形"
   },
   "rule_id": "JW-MAT-002",
   "severity": "cost",
   "source": "rule",
   "status": "pass"
  },
  {
   "facts_used": [
    "min_wall_thickness_mm",
    "setting_type"
   ],
   "reason": {
    "en": "Channel setting needs thicker walls",
    "zh": "槽镶需要更厚的侧壁"
   },
   "rule_id": "JW-ASM-001",
   "severity": "blocker",
   "source": "rule",
   "status": "pass"
  },
  {
   "facts_used": [
    "enamel",
    "hollow_cast"
   ],
   "reason": {
    "en": "Hollow body cannot take enamel",
    "zh": "空心件无法上珐琅"
   },
   "rule_id": "JW-ASM-002",
   "severity": "blocker",
   "source": "rule",
   "status": "pass"
  },
  {
   "facts_used": [
    "stone_count"
   ],
   "reason": {
    "en": "Stone count drives setting hours",
    "zh": "密钉数量过多"
   },
   "rule_id": "JW-SET-004",
   "severity": "cost",
   "source": "rule",
   "status": "pass"
  },
  {
   "facts_used": [
    "prong_count",
    "stone_size_mm"
   ],
   "reason": {
    "en": "Too few prongs for the stone",
    "zh": "爪数不足以固定大石"
   },
   "rule_id": "JW-SET-005",
   "severity": "blocker",
   "source": "rule",
   "status": "pass"
  }
 ],
 "workshop_id": "WS-JW-A"
}
